{
  "version": "1.0",
  "meta": {
    "id": "puzzle-20260322-001",
    "title": "초등영어 퀴즈",
    "date": "2026-03-22",
    "category": "general",
    "difficulty": "easy",
    "source": "초등영어"
  },
  "grid": { "width": 10, "height": 10 },
  "words": [
    {
      "id": "w1",
      "number": 1,
      "answer": "CAKE",
      "clue": "A sweet baked food, often with candles on birthdays.",
      "clue_ko": "생일에 초를 꽂는 달콤한 구운 음식.",
      "direction": "across",
      "startX": 2,
      "startY": 0
    },
    {
      "id": "w2",
      "number": 1,
      "answer": "CLUB",
      "clue": "A group of people who share the same interest.",
      "clue_ko": "같은 관심사를 가진 사람들의 모임.",
      "direction": "down",
      "startX": 2,
      "startY": 0
    },
    {
      "id": "w3",
      "number": 2,
      "answer": "EASE",
      "clue": "When something is not hard, you do it with ___.",
      "clue_ko": "어렵지 않을 때 '편하게' 한다고 표현하는 단어.",
      "direction": "down",
      "startX": 5,
      "startY": 0
    },
    {
      "id": "w4",
      "number": 3,
      "answer": "BLUE",
      "clue": "The color of a clear sky or the deep ocean.",
      "clue_ko": "맑은 하늘이나 깊은 바다의 색깔.",
      "direction": "across",
      "startX": 2,
      "startY": 3
    },
    {
      "id": "w5",
      "number": 4,
      "answer": "LESS",
      "clue": "Smaller in amount; the opposite of more.",
      "clue_ko": "'더 많은'의 반대말로, 양이 적은.",
      "direction": "down",
      "startX": 3,
      "startY": 3
    },
    {
      "id": "w6",
      "number": 5,
      "answer": "FISH",
      "clue": "An animal that lives in water and breathes through gills.",
      "clue_ko": "물속에 살며 아가미로 숨을 쉬는 동물.",
      "direction": "across",
      "startX": 1,
      "startY": 6
    },
    {
      "id": "w7",
      "number": 6,
      "answer": "HERO",
      "clue": "A brave person who saves others or does great things.",
      "clue_ko": "다른 사람을 구하거나 훌륭한 일을 하는 용감한 사람.",
      "direction": "down",
      "startX": 4,
      "startY": 6
    },
    {
      "id": "w8",
      "number": 7,
      "answer": "MOON",
      "clue": "The large bright object that orbits Earth and lights the night sky.",
      "clue_ko": "지구 주위를 돌며 밤하늘을 밝히는 천체.",
      "direction": "across",
      "startX": 3,
      "startY": 9
    }
  ]
}
