{
  "version": "1.0",
  "meta": {
    "id": "puzzle-20260323-002",
    "title": "게임 영어 퀴즈",
    "date": "2026-03-23",
    "category": "general",
    "difficulty": "medium",
    "source": "게임"
  },
  "grid": { "width": 8, "height": 8 },
  "words": [
    {
      "id": "w1",
      "number": 1,
      "answer": "MOUSE",
      "clue": "A device you move on a desk to control a computer cursor.",
      "clue_ko": "컴퓨터 커서를 제어하기 위해 책상 위에서 움직이는 장치.",
      "direction": "across",
      "startX": 2,
      "startY": 2
    },
    {
      "id": "w2",
      "number": 1,
      "answer": "MUSIC",
      "clue": "The background sounds and melodies that set the mood in a game.",
      "clue_ko": "게임의 분위기를 만드는 배경 사운드와 멜로디.",
      "direction": "down",
      "startX": 2,
      "startY": 2
    },
    {
      "id": "w3",
      "number": 2,
      "answer": "USAGE",
      "clue": "How much or how often something is used.",
      "clue_ko": "무언가를 사용하는 빈도나 방식.",
      "direction": "down",
      "startX": 4,
      "startY": 2
    },
    {
      "id": "w4",
      "number": 3,
      "answer": "ERECT",
      "clue": "To build or set something up in an upright position.",
      "clue_ko": "무언가를 세우거나 직립 상태로 건축하다.",
      "direction": "down",
      "startX": 6,
      "startY": 2
    },
    {
      "id": "w5",
      "number": 4,
      "answer": "STAGE",
      "clue": "A level or section of a game the player must complete.",
      "clue_ko": "플레이어가 완료해야 하는 게임의 레벨 또는 구간.",
      "direction": "across",
      "startX": 2,
      "startY": 4
    },
    {
      "id": "w6",
      "number": 5,
      "answer": "CHEST",
      "clue": "A locked box in a game that holds items, gold, or rewards.",
      "clue_ko": "게임에서 아이템, 골드, 보상이 들어있는 잠긴 상자.",
      "direction": "across",
      "startX": 2,
      "startY": 6
    }
  ]
}
