{
  "version": "1.0",
  "meta": {
    "id": "puzzle-20260323-001",
    "title": "초등영어 퀴즈",
    "date": "2026-03-23",
    "category": "general",
    "difficulty": "easy",
    "source": "초등영어"
  },
  "grid": { "width": 8, "height": 8 },
  "words": [
    {
      "id": "w1",
      "number": 1,
      "answer": "APPLE",
      "clue": "A common fruit, often red or green.",
      "clue_ko": "흔한 과일로, 빨갛거나 초록색인 것.",
      "direction": "across",
      "startX": 2,
      "startY": 2
    },
    {
      "id": "w2",
      "number": 1,
      "answer": "ATTIC",
      "clue": "The room directly under the roof of a house.",
      "clue_ko": "집 지붕 바로 아래에 있는 방.",
      "direction": "down",
      "startX": 2,
      "startY": 2
    },
    {
      "id": "w3",
      "number": 2,
      "answer": "PLANE",
      "clue": "A flying machine with wings that carries people.",
      "clue_ko": "날개가 있어 사람을 태우고 나는 기계.",
      "direction": "down",
      "startX": 4,
      "startY": 2
    },
    {
      "id": "w4",
      "number": 3,
      "answer": "ENTER",
      "clue": "To go or come into a room or building.",
      "clue_ko": "방이나 건물 안으로 들어가다.",
      "direction": "down",
      "startX": 6,
      "startY": 2
    },
    {
      "id": "w5",
      "number": 4,
      "answer": "TOAST",
      "clue": "Bread heated until crispy and golden brown.",
      "clue_ko": "바삭하고 황금빛 갈색이 될 때까지 구운 빵.",
      "direction": "across",
      "startX": 2,
      "startY": 4
    },
    {
      "id": "w6",
      "number": 5,
      "answer": "CHEER",
      "clue": "To shout happily and support someone.",
      "clue_ko": "기쁘게 소리치며 누군가를 응원하다.",
      "direction": "across",
      "startX": 2,
      "startY": 6
    }
  ]
}
