{
  "version": "1.0",
  "meta": {
    "id": "puzzle-20260321-002",
    "title": "생활영어 영어 퀴즈",
    "date": "2026-03-21",
    "category": "general",
    "difficulty": "easy",
    "source": "생활영어"
  },
  "grid": { "width": 8, "height": 8 },
  "words": [
    {
      "id": "w1",
      "number": 1,
      "answer": "HAPPY",
      "clue": "Feeling or showing pleasure, contentment, or joy.",
      "clue_ko": "기쁨이나 만족감을 느끼거나 표현하는 상태. '행복한'.",
      "direction": "across",
      "startX": 1,
      "startY": 1
    },
    {
      "id": "w2",
      "number": 2,
      "answer": "APPLE",
      "clue": "A common round fruit, typically red or green, that grows on trees.",
      "clue_ko": "나무에서 자라는 흔한 둥근 과일. 빨간색이나 초록색. '사과'.",
      "direction": "down",
      "startX": 2,
      "startY": 1
    },
    {
      "id": "w3",
      "number": 3,
      "answer": "LEARN",
      "clue": "To gain knowledge or a skill through study, experience, or being taught.",
      "clue_ko": "공부나 경험을 통해 지식이나 기술을 습득하다. '배우다'.",
      "direction": "down",
      "startX": 5,
      "startY": 3
    },
    {
      "id": "w4",
      "number": 4,
      "answer": "PLACE",
      "clue": "A particular position, area, or location.",
      "clue_ko": "특정 위치나 지역, 장소. '장소, 곳'.",
      "direction": "across",
      "startX": 1,
      "startY": 4
    }
  ]
}
