{
  "version": "1.0",
  "meta": {
    "id": "puzzle-20260321-001",
    "title": "AI 기술 영어 퀴즈",
    "date": "2026-03-21",
    "category": "tech",
    "difficulty": "medium",
    "source": "Google Gemini 2.5 발표 뉴스"
  },
  "grid": {
    "width": 10,
    "height": 10
  },
  "words": [
    {
      "id": "w1",
      "number": 1,
      "answer": "GEMINI",
      "clue": "Google's most capable AI model family.",
      "clue_ko": "구글의 가장 강력한 AI 모델 패밀리.",
      "direction": "across",
      "startX": 1,
      "startY": 1
    },
    {
      "id": "w2",
      "number": 2,
      "answer": "MIND",
      "clue": "The element of a person that enables them to be aware of the world.",
      "clue_ko": "사람이 세상을 인식할 수 있게 하는 요소.",
      "direction": "down",
      "startX": 3,
      "startY": 1
    },
    {
      "id": "w3",
      "number": 3,
      "answer": "INDIA",
      "clue": "A large country in South Asia with the world's largest population.",
      "clue_ko": "세계 최대 인구를 보유한 남아시아의 대국.",
      "direction": "across",
      "startX": 1,
      "startY": 4
    },
    {
      "id": "w4",
      "number": 4,
      "answer": "DATE",
      "clue": "The day of the month or year as specified by a number.",
      "clue_ko": "숫자로 지정된 월 또는 연도의 날.",
      "direction": "down",
      "startX": 5,
      "startY": 3
    }
  ]
}
